{
  "$schema": "/schemas/theme-v2.schema.json",
  "schemaVersion": 2,
  "documentType": "music-overlay.theme",
  "id": "anime-pink",
  "revision": 1,
  "metadata": {
    "name": "Anime Pink",
    "themeType": "builtin",
    "sourceThemeId": "anime-pink",
    "migratedFrom": "legacy-config-v1"
  },
  "scene": {
    "ref": "/scenes/classic-two-stage.scene.json",
    "overrides": {
      "appearance": {
        "colors": {
          "background": "rgba(45, 12, 38, 0.82)",
          "text": "#ffe6f5",
          "progress": "#ff7ad9",
          "progressBackground": "rgba(255, 122, 217, 0.22)"
        },
        "font": {
          "family": "Trebuchet MS",
          "titleSize": 25,
          "artistSize": 16,
          "tickerSize": 14
        },
        "albumArt": {
          "useWindowsThumbnail": false,
          "defaultCover": "/assets/default-cover.png"
        },
        "ticker": {
          "style": "glass"
        },
        "fullCard": {
          "style": "glass"
        },
        "vinyl": {
          "style": "cd"
        },
        "particles": {
          "enabled": true,
          "style": "hearts",
          "count": 2,
          "size": 18,
          "durationMs": 2200,
          "color": "#ff7ad9"
        },
        "equalizer": {
          "enabled": true,
          "style": "neon",
          "barCount": 56,
          "barWidth": 5,
          "gap": 3,
          "height": 78,
          "offsetY": 1,
          "sidePadding": 8,
          "preset": "dynamicBars",
          "sensitivity": 1.12,
          "smoothing": 0.28,
          "autoGain": true,
          "outputGain": 1.0,
          "spectralContrast": 1.0,
          "visualCurvePower": 1.0,
          "glow": true,
          "glowPower": 24,
          "colorMode": "progress",
          "color": "#ff7ad9"
        }
      }
    }
  }
}
